{
  "connector_id": "generic_crm",
  "human_name": "CRM genérico (HubSpot/Salesforce/Zoho/Pipedrive/Dynamics)",
  "category": "crm",
  "recommended_route": "managed_oauth",
  "fallback_routes": ["openapi_rest", "import_export_batch", "human_manual"],
  "difficulty": "guided",
  "default_mode": "read_only",
  "safe_defaults": {
    "read": true,
    "write": false
  },
  "capabilities": ["crm.contacts.read", "crm.deals.read"],
  "gated_capabilities": {
    "crm.contacts.write": "gate_business_write",
    "crm.deals.update": "gate_business_write",
    "crm.bulk_export": "gate_data_export"
  },
  "forbidden_capabilities": [],
  "setup_steps": [
    {
      "step_id": "1",
      "kind": "external_page",
      "description": "Elegir el proveedor CRM concreto y abrir su panel de API/OAuth"
    },
    {
      "step_id": "2",
      "kind": "user_action",
      "description": "Autorizar acceso de solo lectura a contactos y oportunidades"
    }
  ],
  "permissions_explainer": {
    "will": [
      "Leer contactos y pipeline de oportunidades"
    ],
    "will_not": [
      "Modificar registros ni exportar en bloque sin tu aprobación explícita"
    ]
  },
  "credential": {
    "auth_mode": "oauth2",
    "storage": "credential_reference_only"
  },
  "legal_notes": null,
  "demo": true
}
